{
  "$schema": "https://json-schema.org/draft/2020-12/schema",
  "$id": "https://github.com/GBeurier/dag-ml/schemas/training_outcome.v1.schema.json",
  "title": "DAG-ML TrainingOutcome v1",
  "description": "Portable result of compile/plan/FIT_CV/SELECT and optional REFIT. Semantic validation closes transitively from bound outputs through node_plans.input_nodes and requires exact patch, influence, lineage, artifact and cache coverage. It contains no runtime handle and is the exact object bound by PredictorBinding.training_outcome_fingerprint.",
  "type": "object",
  "additionalProperties": false,
  "required": [
    "schema_version",
    "outcome_id",
    "run_id",
    "training_request_fingerprint",
    "data_identities",
    "effective_plan",
    "effective_plan_fingerprint",
    "selected_variant_id",
    "selected_variant_fingerprint",
    "selection_output_id",
    "parameter_patches",
    "refit",
    "score_set",
    "outputs",
    "lineage",
    "portable_prediction_caches",
    "training_influence",
    "execution_bundle",
    "replayable_phases",
    "warnings",
    "diagnostics",
    "outcome_fingerprint"
  ],
  "properties": {
    "schema_version": {
      "type": "integer",
      "const": 1
    },
    "outcome_id": {
      "$ref": "#/$defs/identifier"
    },
    "run_id": {
      "$ref": "#/$defs/identifier"
    },
    "training_request_fingerprint": {
      "$ref": "#/$defs/sha256",
      "description": "Exact fingerprint of the signed TrainingRequest executed to produce this outcome."
    },
    "data_identities": {
      "type": "array",
      "items": {
        "$ref": "https://github.com/GBeurier/dag-ml/schemas/training_request.v1.schema.json#/$defs/training_data_identity"
      },
      "description": "Strictly sorted exact data identities attested by RuntimeDataProvider before controller execution."
    },
    "effective_plan": {
      "$ref": "https://github.com/GBeurier/dag-ml/schemas/execution_plan.v1.schema.json"
    },
    "effective_plan_fingerprint": {
      "$ref": "#/$defs/sha256",
      "description": "DAG-ML TCV1 SHA-256 of effective_plan. Existing graph/campaign/controller/params fingerprints keep their historical serde_json algorithms."
    },
    "selected_variant_id": {
      "$ref": "#/$defs/identifier"
    },
    "selected_variant_fingerprint": {
      "$ref": "#/$defs/sha256"
    },
    "selection_output_id": {
      "$ref": "#/$defs/identifier",
      "description": "OutputBinding id whose producer-specific averaged FIT_CV reports were ranked to produce the selection decision."
    },
    "parameter_patches": {
      "type": "array",
      "items": {
        "$ref": "https://github.com/GBeurier/dag-ml/schemas/parameter_patch.v1.schema.json"
      },
      "default": [],
      "description": "Canonical order is (node_id, namespace, path); duplicate targets are invalid. The array is exactly the selected variant's recursively materialized param_overrides leaves."
    },
    "refit": {
      "$ref": "#/$defs/refit_outcome"
    },
    "score_set": {
      "$ref": "https://github.com/GBeurier/dag-ml/schemas/score_set.v1.schema.json",
      "description": "Mandatory OOF evaluation reports used by SELECT; TrainingOutcome v1 always represents compile through FIT_CV and SELECT."
    },
    "outputs": {
      "type": "array",
      "minItems": 1,
      "items": {
        "$ref": "https://github.com/GBeurier/dag-ml/schemas/output_binding.v1.schema.json#/$defs/bound_output"
      }
    },
    "lineage": {
      "type": "array",
      "minItems": 1,
      "items": {
        "$ref": "https://github.com/GBeurier/dag-ml/schemas/node_result.v1.schema.json#/$defs/lineage_record"
      },
      "description": "Sorted portable lineage. Semantic validation requires one FIT_CV record per supported predictor-closure node/fold and, after completed refit, one REFIT record per supported closure node with exact upstream and artifact references."
    },
    "portable_prediction_caches": {
      "anyOf": [
        {
          "$ref": "https://github.com/GBeurier/dag-ml/schemas/prediction_cache_payload_set.v1.schema.json"
        },
        {
          "type": "null"
        }
      ],
      "default": null,
      "description": "When execution_bundle carries prediction caches, this payload set is non-null and its requirement keys and block fingerprints match exactly. A no-refit outcome may retain OOF caches for later REFIT replay."
    },
    "training_influence": {
      "$ref": "https://github.com/GBeurier/dag-ml/schemas/training_influence_manifest.v1.schema.json"
    },
    "execution_bundle": {
      "$ref": "https://github.com/GBeurier/dag-ml/schemas/execution_bundle.v1.schema.json"
    },
    "methods_hpo_resume_state": {
      "anyOf": [
        { "$ref": "https://github.com/GBeurier/dag-ml/schemas/execution_bundle.v1.schema.json#/$defs/methods_hpo_resume_state" },
        { "type": "null" }
      ],
      "default": null
    },
    "replayable_phases": {
      "type": "array",
      "uniqueItems": true,
      "items": {
        "enum": ["REFIT", "PREDICT", "EXPLAIN"]
      },
      "description": "Phases this outcome can honestly replay, deterministically derived from the full effective predictor closure and the retained artifacts/caches, never from the refit flag alone. Canonical order is REFIT, PREDICT, EXPLAIN and validation enforces exact order and set equality against a re-derivation. A closure node requires retained inference state exactly when its controller capabilities are Stateful OR EmitsArtifacts; the artifact_policy value (including ReplayRequired) and fit_scope alone never imply retained state, so a stateless deterministic operator (e.g. a replay_required transform that recomputes at inference) needs no retained artifact. A completed refit never re-advertises REFIT; it exposes PREDICT and/or EXPLAIN only when every closure node supports that phase and every state-retaining (Stateful or EmitsArtifacts) closure node has a retained refit artifact. A skipped refit exposes REFIT only when every closure node supports REFIT and every closure requires_oof dependency is backed by a self-contained retained cache record and portable payload. The empty array is valid and is preferable to advertising a false capability."
    },
    "warnings": {
      "type": "array",
      "default": [],
      "uniqueItems": true,
      "items": {
        "$ref": "#/$defs/non_empty_string"
      }
    },
    "diagnostics": {
      "type": "object",
      "default": {},
      "additionalProperties": true
    },
    "outcome_fingerprint": {
      "$ref": "#/$defs/sha256",
      "description": "DAG-ML TCV1 SHA-256 of this complete portable outcome with only outcome_fingerprint omitted."
    }
  },
  "$defs": {
    "identifier": {
      "type": "string",
      "minLength": 1,
      "maxLength": 128,
      "pattern": "^[A-Za-z0-9_.:-]+$"
    },
    "non_empty_string": {
      "type": "string",
      "minLength": 1
    },
    "sha256": {
      "type": "string",
      "pattern": "^[0-9a-f]{64}$"
    },
    "refit_outcome": {
      "type": "object",
      "additionalProperties": false,
      "required": ["requested", "status", "strategy"],
      "properties": {
        "requested": {
          "type": "boolean"
        },
        "status": {
          "enum": ["completed", "skipped"]
        },
        "strategy": {
          "anyOf": [
            {
              "enum": ["refit_one", "refit_ensemble"]
            },
            {
              "type": "null"
            }
          ],
          "default": null
        }
      },
      "oneOf": [
        {
          "properties": {
            "requested": {
              "const": true
            },
            "status": {
              "const": "completed"
            },
            "strategy": {
              "enum": ["refit_one", "refit_ensemble"]
            }
          }
        },
        {
          "properties": {
            "requested": {
              "const": false
            },
            "status": {
              "const": "skipped"
            },
            "strategy": {
              "type": "null"
            }
          }
        }
      ]
    }
  }
}
