{
  "schema_version": 1,
  "outcome_id": "training:estimator.refit",
  "run_id": "run:estimator.contract",
  "training_request_fingerprint": "2e3fb0f9419ec83630fbe969bf5fa70e6f2951adf6cec86a34223fdadadafdc6",
  "data_identities": [
    {
      "requirement_key": "branch:b0.model:ridge.x",
      "schema_fingerprint": "f97b37872fa22134b508f98fd8e207e5b776b52594fb8f6f5c3e15bee212246b",
      "plan_fingerprint": "7c5431d85574b3f337022fa5d25971d5b5cf445b90331b49938f573ff6901e4d",
      "relation_fingerprint": "a3a7e329df35db9f2883a17b8611b7fae6dcaa031875e3ec2c9be1b9e29cbe10",
      "data_content_fingerprint": "571c0cdb081d894215bdc6959791149471f3fa181af23fb11d54197c90cdf81a",
      "target_content_fingerprint": "9301588c1a32cde32277720d7b8d81011b07a97f926dc5bb7676212b310822f6",
      "identity_fingerprint": "0dbdb34908ca2509902d637e1987447eaff4f7855b0ee6ca49b7f68244ca65b2"
    },
    {
      "requirement_key": "branch:b1.augment:noise.x",
      "schema_fingerprint": "f97b37872fa22134b508f98fd8e207e5b776b52594fb8f6f5c3e15bee212246b",
      "plan_fingerprint": "7c5431d85574b3f337022fa5d25971d5b5cf445b90331b49938f573ff6901e4d",
      "relation_fingerprint": "a3a7e329df35db9f2883a17b8611b7fae6dcaa031875e3ec2c9be1b9e29cbe10",
      "data_content_fingerprint": "54bfc4293f023576e3ba40ecf72a992f7d68dba8b632a43d8268a9e7d17144db",
      "target_content_fingerprint": "5615e8109d58d0ff7fe685a667940ccce619a4a688fec315dcf2d6677c062f9d",
      "identity_fingerprint": "58d0bcfa6d01a67d08ae2e9573624320333bd6b73054d25a8f02848af2863e1d"
    },
    {
      "requirement_key": "merge:stack.pred_plus_original.meta:ridge.x_original",
      "schema_fingerprint": "f97b37872fa22134b508f98fd8e207e5b776b52594fb8f6f5c3e15bee212246b",
      "plan_fingerprint": "7c5431d85574b3f337022fa5d25971d5b5cf445b90331b49938f573ff6901e4d",
      "relation_fingerprint": "a3a7e329df35db9f2883a17b8611b7fae6dcaa031875e3ec2c9be1b9e29cbe10",
      "data_content_fingerprint": "a977366d39ccaa71111aaffa992ef249ebb4f8c4d895b4f7d8d4fe21be76076f",
      "target_content_fingerprint": "764228e3b12c5f23abff7408e39a035503446e3ce862f73d16e22b19ba4e62a1",
      "identity_fingerprint": "cb4e563b790d2d3d69180bf37e3ba38242d78f7f77dbeec596aaa1bb39d32484"
    }
  ],
  "effective_plan": {
    "id": "plan:fixture.execution.branch_merge",
    "graph_plan": {
      "graph": {
        "id": "dsl-branch-merge-executable",
        "interface": {
          "inputs": [
            {
              "name": "x",
              "kind": "data",
              "representation": "tabular_numeric",
              "cardinality": "one",
              "description": ""
            }
          ],
          "outputs": [
            {
              "name": "prediction",
              "kind": "prediction",
              "representation": null,
              "cardinality": "one",
              "description": ""
            }
          ]
        },
        "nodes": [
          {
            "id": "branch:b0.model:ridge",
            "kind": "model",
            "operator": {
              "type": "Ridge"
            },
            "params": {
              "alpha": 0.3
            },
            "ports": {
              "inputs": [
                {
                  "name": "x",
                  "kind": "data",
                  "representation": "tabular_numeric",
                  "cardinality": "one",
                  "description": ""
                }
              ],
              "outputs": [
                {
                  "name": "oof",
                  "kind": "prediction",
                  "representation": null,
                  "cardinality": "one",
                  "description": ""
                }
              ]
            },
            "metadata": {
              "dsl_branch": "b0",
              "dsl_branch_mode": "duplication"
            },
            "seed_label": "branch:b0"
          },
          {
            "id": "branch:b1.augment:noise",
            "kind": "augmentation",
            "operator": {
              "type": "GaussianNoise"
            },
            "params": {
              "scope": "train_only",
              "std": 0.01
            },
            "ports": {
              "inputs": [
                {
                  "name": "x",
                  "kind": "data",
                  "representation": "tabular_numeric",
                  "cardinality": "one",
                  "description": ""
                }
              ],
              "outputs": [
                {
                  "name": "x_out",
                  "kind": "data",
                  "representation": "tabular_numeric",
                  "cardinality": "one",
                  "description": ""
                }
              ]
            },
            "metadata": {
              "dsl_branch": "b1",
              "dsl_branch_mode": "duplication"
            },
            "seed_label": "branch:b1.augment"
          },
          {
            "id": "branch:b1.model:rf",
            "kind": "model",
            "operator": {
              "type": "RandomForestRegressor"
            },
            "params": {
              "n_estimators": 64
            },
            "ports": {
              "inputs": [
                {
                  "name": "x",
                  "kind": "data",
                  "representation": "tabular_numeric",
                  "cardinality": "one",
                  "description": ""
                }
              ],
              "outputs": [
                {
                  "name": "oof",
                  "kind": "prediction",
                  "representation": null,
                  "cardinality": "one",
                  "description": ""
                }
              ]
            },
            "metadata": {
              "dsl_branch": "b1",
              "dsl_branch_mode": "duplication"
            },
            "seed_label": "branch:b1"
          },
          {
            "id": "merge:stack.pred_plus_original.meta:ridge",
            "kind": "model",
            "operator": {
              "type": "RidgeMetaStacker"
            },
            "params": {
              "alpha": 0.2
            },
            "ports": {
              "inputs": [
                {
                  "name": "b0_oof",
                  "kind": "prediction",
                  "representation": null,
                  "cardinality": "one",
                  "description": ""
                },
                {
                  "name": "b1_oof",
                  "kind": "prediction",
                  "representation": null,
                  "cardinality": "one",
                  "description": ""
                },
                {
                  "name": "x_original",
                  "kind": "data",
                  "representation": "tabular_numeric",
                  "cardinality": "one",
                  "description": ""
                }
              ],
              "outputs": [
                {
                  "name": "oof",
                  "kind": "prediction",
                  "representation": null,
                  "cardinality": "one",
                  "description": ""
                }
              ]
            },
            "metadata": {
              "merge_mode": "predictions_plus_original"
            },
            "seed_label": "merge:stack"
          }
        ],
        "edges": [
          {
            "source": {
              "node_id": "branch:b1.augment:noise",
              "port_name": "x_out"
            },
            "target": {
              "node_id": "branch:b1.model:rf",
              "port_name": "x"
            },
            "contract": {
              "kind": "data",
              "representation": "tabular_numeric",
              "requires_oof": false,
              "requires_fold_alignment": true,
              "propagates_lineage": true
            }
          },
          {
            "source": {
              "node_id": "branch:b0.model:ridge",
              "port_name": "oof"
            },
            "target": {
              "node_id": "merge:stack.pred_plus_original.meta:ridge",
              "port_name": "b0_oof"
            },
            "contract": {
              "kind": "prediction",
              "representation": null,
              "requires_oof": true,
              "requires_fold_alignment": true,
              "propagates_lineage": true
            }
          },
          {
            "source": {
              "node_id": "branch:b1.model:rf",
              "port_name": "oof"
            },
            "target": {
              "node_id": "merge:stack.pred_plus_original.meta:ridge",
              "port_name": "b1_oof"
            },
            "contract": {
              "kind": "prediction",
              "representation": null,
              "requires_oof": true,
              "requires_fold_alignment": true,
              "propagates_lineage": true
            }
          }
        ],
        "search_space_fingerprint": "77b9ec07501659b5f620e8815278b621dc8bd1bf5daa59c194d4cd1eb2bcdd2c",
        "metadata": {
          "demo": "executable branch/merge DSL with coordinated variants and heterogeneous merge"
        }
      },
      "topological_order": [
        "branch:b0.model:ridge",
        "branch:b1.augment:noise",
        "branch:b1.model:rf",
        "merge:stack.pred_plus_original.meta:ridge"
      ],
      "parallel_levels": [
        [
          "branch:b0.model:ridge",
          "branch:b1.augment:noise"
        ],
        [
          "branch:b1.model:rf"
        ],
        [
          "merge:stack.pred_plus_original.meta:ridge"
        ]
      ]
    },
    "campaign": {
      "id": "campaign:dsl.branch.merge.executable",
      "root_seed": 12345,
      "leakage_policy": {
        "split_unit": "sample",
        "forbid_origin_cross_fold": true,
        "allow_observation_split_with_shared_target": false,
        "require_group_ids": false,